time,num_replies,num_likes,num_retweets,tweet_text
2020-02-10T02:38:19.000Z,3.2K,176.3K,23.4K,"Congrats to Julia and Steven, the filmmakers behind American Factory, for telling such a complex, moving story about the very human consequences of wrenching economic change. Glad to see two talented and downright good people take home the Oscar for Higher Ground’s first release."
2020-02-01T20:36:40.000Z,6K,330.2K,49.3K,"Sixty years ago today, the Greensboro Four stood up to injustice by sitting down at a lunch counter. Our journey is full of such stories; of acts of patriotic protest that challenge this country we love to live up to our highest ideals, however long it takes. "
2020-01-26T21:56:16.000Z,17.3K,4.1M,691.8K,Kobe was a legend on the court and just getting started in what would have been just as meaningful a second act. To lose Gianna is even more heartbreaking to us as parents. Michelle and I send love and prayers to Vanessa and the entire Bryant family on an unthinkable day.
2020-01-20T14:35:29.000Z,5.2K,264.3K,53.4K,"Every so often, I re-read Dr. King’s Letter from a Birmingham Jail. While some of the injustices may have changed, his poetic brilliance, moral clarity, and tests of conscience still reverberate today. Take a moment to reflect on his righteous call:"
2019-12-30T00:33:16.000Z,3K,230.8K,27.3K,If there’s one thing I love about 
2019-12-29T17:03:13.000Z,8K,229.9K,28.6K,"Next up are my favorite movies and TV shows of 2019. Of course, there’s also American Factory, a film from our own production company, Higher Ground, that was recently shortlisted for an Oscar. Here’s the full list:"
2019-12-28T21:16:40.000Z,10.4K,278.6K,45.5K,"As we wind down 2019, I wanted to share with you my annual list of favorites that made the last year a little brighter. We’ll start with books today — movies and music coming soon. I hope you enjoy these as much as I did."
2019-12-25T00:00:22.000Z,33.3K,1M,77.4K,"From the Obama family to yours, Merry Christmas!"
2019-12-23T20:50:19.000Z,4.1K,223.8K,19K,"On behalf of my family, Chag Sameach and Happy Hanukkah! As Jews around the world celebrate, let the menorah’s light remind us all of the miracles in our own lives."
2019-12-19T19:54:31.000Z,4.5K,113K,16.1K,"2019 was full of moments that show humanity at its best—compassionate, entrepreneurial, determined. And yes, hopeful. Take a look to see for yourself."
2019-12-17T18:36:41.000Z,677,8.5K,1.4K,The Obama Foundation
2019-12-17T18:36:41.000Z,677,8.5K,1.4K,The Obama Foundation
2019-12-17T01:15:00.000Z,240,3.2K,973,Get America Covered
2019-11-27T18:19:13.000Z,7.3K,149.1K,28.3K,"Before arguing with friends or family around the Thanksgiving table, take a look at the science behind arguing better. And it'll never hurt to try this: ""Listen to people, get them to think about their own experience, and highlight your common humanity."""
2019-11-24T18:07:38.000Z,1.5K,31.5K,6.9K,"Politicians shouldn’t be picking their voters. Voters should be picking their representatives. But unless we act, the status quo will remain in states all across the country. Let's make sure maps are drawn fairly when redistricting happens again in 2021:"
2019-11-24T18:04:14.000Z,3.1K,88K,20.8K,"Take a look at this piece to understand the very real consequences of gerrymandering. In Asheville, NC, we see what happens when district lines are drawn for maximum partisan advantage: It mean citizens’ voices are diminished. It means more polarization."
2019-11-22T16:08:56.000Z,1.5K,44.3K,4.3K,Young leaders like these are powering the promise of the Asia Pacific region. Michelle and I couldn’t be more impressed by their initiative. Can’t wait to join them in Malaysia next month.
2019-11-18T18:39:05.000Z,1.5K,48.9K,8.4K,Proud to see Oluwaseun 
2019-11-11T14:34:54.000Z,1.8K,44.2K,5.3K,"Stories like this are a reminder of our duty, as a country and as Americans, to support every veteran—not only in words, but in deed. To every veteran out there, thank you. We’re forever in your debt."
2019-11-11T14:34:22.000Z,3.8K,137.3K,19.9K,"This Veterans Day, here’s a moving portrait of the extraordinary resilience of my friend Cory Remsburg, an Army Ranger I’ve come to know over the years. It’s an honest tribute to all those wounded warriors and their families who give so much to our country"
2019-11-08T16:39:31.000Z,2.9K,86.8K,10.4K,No one says it better than 
2019-11-06T18:32:50.000Z,6.7K,320.3K,33.6K,"Proud of all the Americans who showed up to vote yesterday, electing a set of hopeful, forward-thinking leaders primed to protect Medicaid, draw fair voting maps, and reduce gun violence. A great night for our country—one that’ll leave a lasting legacy."
2019-11-02T14:04:46.000Z,3.4K,69.7K,11.6K,"Proud to endorse an outstanding group of Virginia Democrats in Tuesday’s election—candidates who’ll not only advance the causes of equality, justice, and decency, but help ensure that the next decade of voting maps are drawn fairly. That’s good policy—and good for our politics."
2019-10-11T12:22:03.000Z,983,37.5K,3.5K,Michelle Obama
2019-10-11T13:52:07.000Z,1.6K,59K,5.8K,Congrats to the 
2019-10-09T19:41:11.000Z,2.6K,61.3K,11K,"Here’s an interesting read—a reminder that behind every opinion lies a human being with real experiences and a story to tell. Sometimes we’ll agree and sometimes we won’t, but if we want our democracy work, listening to each other isn’t optional."
2019-10-08T13:54:05.000Z,3.4K,93.6K,8.9K,"As President, I leaned on "
2019-10-03T14:10:50.000Z,27.1K,1.9M,213.7K,"Like the Beatles said: It’s getting better all the time. Thanks, babe, for 27 amazing years!"
2019-09-24T16:03:21.000Z,3.8K,65K,17.5K,"On National Voter Registration Day, it’s up to us as citizens to make sure everyone we know can make their voices heard at the ballot box. Check and update your registration at "
2019-09-20T20:38:04.000Z,7.6K,247.9K,39.8K,One challenge will define the future for today’s young generation more dramatically than any other: Climate change. The millions of young people worldwide who’ve organized and joined today’s 
2019-09-17T20:24:37.000Z,8.6K,353.1K,54.3K,"Just 16, "
2019-09-12T18:10:20.000Z,1K,17K,3K,That’s what Americans do when others are in need – we help. We give. We inspire. Want to make a difference? There are a number of ways you can help right here:
2019-09-12T18:09:58.000Z,705,24.2K,3.1K,"Jermaine Bell is just six years old, but when he saw people in need, he took the money he’d been saving for a trip to Disney World and spent it on food and water for South Carolina evacuees."
2019-09-12T18:09:32.000Z,1.5K,56.8K,8.6K,Bahamian families and communities face a long recovery from Hurricane Dorian. And Americans are reaching out to help. Brittany Garvin is helping people reunite and evacuate.
2019-09-11T12:19:35.000Z,4.5K,183.7K,32.7K,"As we remember those we lost on 9/11, we also remember the spirit of unity and togetherness that defined the weeks and months after. On this day of service, I’m reflecting on all those still working to embrace that spirit, today and every day."
2019-08-05T19:01:51.000Z,31.4K,1M,294.8K,31.4K
2019-08-01T19:52:19.000Z,6.5K,151K,21.9K,"The families of our wounded warriors don't often get a lot of fanfare, but they're serving and sacrificing right alongside their loved ones. We all owe a debt to them, too, and Fisher House is always making sure we're serving those who serve us."
2019-07-31T17:32:01.000Z,1.9K,32.8K,6.6K,Recent court decisions make it clear that the change we need to restore our democracy has to come from the ground up. 
2019-07-28T18:19:19.000Z,4.7K,61.4K,11.3K,"Here’s a worthwhile Sunday read: “…nothing should temper partisanship more than an awareness that somewhere, on some issue, people with whom you disagree are telling a story that you really need to hear.”"
2019-07-27T18:01:42.000Z,15.3K,179.8K,33.6K,"I’ve always been proud of what this team accomplished during my administration. But more than what we did, I’m proud of how they’re continuing to fight for an America that’s better."
2019-07-25T20:32:47.000Z,723,9.3K,1.5K,The Obama Foundation
2019-07-23T21:03:01.000Z,840,24.5K,4.1K,"Economist Raj Chetty is not only identifying the decline in opportunity we’ve seen in recent decades—but trying to reverse it. Inequality, like many problems we face, is as vast as it is complex. But this article left me a little more hopeful:"
2019-07-23T21:02:29.000Z,2.6K,64K,13.5K,Here are a couple of articles backed by new research that are worth taking a look at: A new study on the Medicaid expansion my administration fought for under the Affordable Care Act—and how these policy decisions affect lives in real terms:
2019-07-20T14:40:10.000Z,3.4K,120.4K,17.7K,"In America, we don’t fear the future, we embrace it. 50 years ago, that spirit took us to the moon. Today, it’s embodied by people like Tiffany Davis. She’s a young rocket scientist who is helping us explore the next frontier, wherever that might take us."
2019-07-19T19:46:43.000Z,20.5K,588.3K,126.9K,Michelle Obama
2019-07-01T16:03:09.000Z,2.5K,53.7K,13K,"The most important job in our democracy is citizen. If you’re tired of politicians manipulating maps and ignoring the will of voters, I hope you’ll sign "
2019-06-28T16:56:15.000Z,4.1K,181.7K,26.4K,"50 years ago, history was written at the Stonewall Inn when New York's LGBT community stood up, spoke out, and started a movement. In 2016 I was proud to designate it as a national monument—a reminder the arc of our history is an arc of progress as long as we keep pushing for it."
2019-06-27T20:08:06.000Z,1.5K,66.8K,6.9K,What a gift to come across this interview with Julia “Hurricane” Hawkins. I’m as grateful for her life advice as I am impressed by her 100-meter dash time.
2019-06-21T18:13:24.000Z,2.3K,89K,7.7K,"Now we’re talking! Congrats to Team USA for moving on, and thanks for continuing to make us all proud. "
2019-06-19T17:01:20.000Z,2.9K,159.1K,23.1K,"On Juneteenth, we celebrate our capacity to make real the promise of our founding, that thing inside each of us that says America is not yet finished, that compels all of us to fight for justice and equality until this country we love more closely aligns with our highest ideals."
2019-06-19T17:00:44.000Z,4.3K,288K,47.1K,"Outside the Oval Office, I kept a painting of a small crowd huddled around a pocketwatch, waiting for the moment the Emancipation Proclamation took effect. On Juneteenth, we celebrate the anniversary of that news - freedom - reaching slaves in Texas. And something more:"
2019-06-18T18:17:55.000Z,2.1K,46.4K,8.9K,"This is worth a read: a thought-provoking reminder that education reform isn’t a cure-all. As a supporter of education reform, I agree that fixing educational inequality requires doing more to address the broader, systemic sources of economic inequality."
2019-06-16T18:08:20.000Z,3.6K,235.6K,31K,"Yes we can, Greta. I’m hopeful because of you and all the young people who are fighting to protect the planet. Keep at it."
2019-06-16T13:47:03.000Z,2.3K,79.4K,11.9K,"Happy Father’s Day to Charles, one of our "
2019-06-14T20:51:12.000Z,537,8.7K,1.3K,The Obama Foundation
2019-06-11T16:15:32.000Z,2.6K,102.2K,12.3K,The 
2019-06-10T15:52:11.000Z,2.2K,195.8K,29.1K,"Six years ago, David Ortiz's spirit and resolve helped us all begin to heal from the Boston Marathon bombing. Today, I want to join many others in wishing him a speedy recovery of his own. Get well soon, Papi."
2019-06-07T14:27:18.000Z,8.3K,172.8K,31.7K,"Last week, it was Virginia Beach. But day after day and year after year, too many families and communities are shattered by senseless gun violence. We can't get numb to this. On National Gun Violence Awareness Day, pledge to speak out, "
2019-05-20T22:33:00.000Z,1.3K,18.3K,2.3K,The Obama Foundation
2019-05-20T18:50:12.000Z,4.1K,117.5K,17K,"Here’s a great story: While we’ve still got a lot of work to do to make college affordable for everyone, that didn’t stop Robert F. Smith from seizing an opportunity to make a difference. He’s erasing the student loan debt for this year’s "
2019-05-12T15:32:16.000Z,11.1K,730.3K,53.1K,"Happy Mother's Day to the most caring, brilliant, funny, and grounded woman I know—a perfect role model not just for our daughters, but so many others. Love you, "
2019-05-09T16:18:19.000Z,1.4K,33.5K,4.2K,As part of the 
2019-05-06T16:04:25.000Z,1.7K,158.6K,13.4K,Michelle Obama
2019-05-01T20:50:43.000Z,3.8K,119.2K,13.9K,Happy 
2019-04-30T20:31:44.000Z,3K,209.8K,25.2K,"Condolences to the family of John Singleton. His seminal work, Boyz n the Hood, remains one of the most searing, loving portrayals of the challenges facing inner-city youth. He opened doors for filmmakers of color to tell powerful stories that have been too often ignored."
2019-04-30T14:53:16.000Z,2.1K,51.7K,7.3K,Congratulations to the new class of 
2019-04-28T19:16:19.000Z,2.1K,70.1K,8.9K,"For thirty-six years, Richard Lugar proved that pragmatism and decency work—not only in Washington but all over the world. Michelle and I send our warmest sympathies to his family and all those who had the privilege of knowing this American statesman."
2019-04-23T21:02:20.000Z,1.8K,52.1K,6.1K,Dominique’s story is a reminder to us that where you’re from shouldn’t define what you can achieve. I’m proud of her and all students striving for a better future.
2019-04-11T00:08:43.000Z,2.9K,185K,21.1K,"From a big NBA fan, congrats to future Hall of Famers Dwyane Wade and Dirk Nowitzki—not just all-time greats but class acts, too."
2019-04-06T13:16:18.000Z,2.7K,37.5K,5.1K,"In just a few minutes, I’m taking the stage at the "
2019-04-05T16:25:09.000Z,2.8K,133.4K,27.2K,A voice everybody should hear.
2019-04-04T19:23:45.000Z,2.2K,78.8K,15.1K,Here’s a story about people doing good that's worth sharing: 
2019-04-03T19:07:17.000Z,2.5K,96.6K,8.5K,"Great to see Chicago’s historic mayoral race between two highly qualified candidates. Congrats to our next mayor, Lori Lightfoot—and Toni Preckwinkle campaigned hard and did us proud. I know that with our city’s heart and Lori’s leadership, Chicago’s best days are still ahead."
2019-04-02T13:08:49.000Z,2.3K,66.5K,6.6K,Valerie is one of my oldest friends and advisors – she was by my side when I first decided to run for office and for every major moment of the presidency. 
2019-03-26T18:33:57.000Z,6.5K,116.4K,13.7K,"Last night I had the chance to meet with first-term Democrats in Congress—it's a young, diverse class, stocked with a bunch of my campaign and administration alums who’ve taken the torch. This group is going to be driving progress for a long time to come."
2019-03-21T15:43:47.000Z,4.6K,58.1K,7.9K,"Just in the nick of time: My brackets have never been my one shining moment, but here we go again. You can check out my "
2019-03-20T14:20:35.000Z,1.3K,36.8K,8K,"And here are some ways to help cyclone victims in Mozambique, Malawi, and Zimbabwe:"
2019-03-20T14:19:59.000Z,2.8K,84.8K,17.8K,The floods in the Midwest and in southern Africa are heartbreaking. Suffering and loss on two sides of the world calls for solidarity and strength from all of us. Ask what you can do to help our fellow Americans and families in need. Here are some ideas:
2019-04-05T16:25:09.000Z,2.8K,133.4K,27.2K,A voice everybody should hear.
2019-03-08T13:29:54.000Z,5.3K,484.7K,102.7K,"On International Women’s Day, I’m reflecting on the future we all want for our daughters: one where they can live out their aspirations without limits. And I’m celebrating some of the women who are building that future for all of us today."
2019-02-21T19:01:39.000Z,4.2K,96.1K,20.3K,It’s up to all of us as citizens to make sure that the rules of democracy are fair—everywhere—because the next decade of our nation's progress is on the line. Join me and 
2019-02-21T04:41:44.000Z,3.7K,303.6K,30.9K,Zion Williamson seems like an outstanding young man as well as an outstanding basketball player. Wishing him a speedy recovery.
2019-02-20T00:02:24.000Z,2.8K,103.8K,10.5K,I’m about to join 
2019-02-18T19:56:06.000Z,1.5K,25.1K,4.9K,The Obama Foundation
2019-02-16T20:40:27.000Z,3.6K,156.3K,22.2K,"I’ve always loved basketball because it’s about building a team that’s equal to more than the sum of its parts. Glad to see this expansion into Africa because for a rising continent, this can be about a lot more than what happens on the court."
2019-02-14T18:32:00.000Z,5.8K,411.1K,36.5K,"Happy Valentine’s Day to the extraordinarily smart, beautiful, funny, one and only "
2019-02-14T15:18:47.000Z,5.6K,471.7K,71.3K,"In the year since their friends were killed, the students of Parkland refused to settle for the way things are and marched, organized, and pushed for the way things should be - helping pass meaningful new gun violence laws in states across the country. I'm proud of all of them."
2019-02-14T03:10:37.000Z,4.2K,290.7K,33.9K,"Don’t be sad it’s over, be proud it taught us so much. Congrats to all the men and women of "
2019-02-13T01:18:20.000Z,1.9K,125.1K,11.7K,Happy 85th birthday to 
2018-12-29T16:15:20.000Z,1.3K,110.7K,18.7K,"Leaders like Jonny Boucher, a Chicago native who, after losing too many friends and family to suicide, started a coffee shop to offer emotional support and guidance to those who might be in need of a little more than a strong cup of coffee to get through their day."
2018-12-29T16:15:20.000Z,393,28.3K,3.5K,"Leaders like Hong Hoang, who mobilized a youth-led movement to create a greener world after becoming the first Vietnamese person to visit Antarctica."
2018-12-29T16:15:19.000Z,343,26.3K,3.6K,"Leaders like Moussa Kondo and Sandor Lederer, who are each doing their part to fight corruption in their native countries of Mali and Hungary. Two people separated by continents but united in their pursuit of a more just, transparent society."
2018-12-29T16:15:18.000Z,439,34.2K,4.9K,"Leaders like Dejah Powell, who started an organization to bring health and wellness resources to communities on the South Side of Chicago, expanding food access and providing people the space and time to take care of themselves."
2018-12-29T16:15:18.000Z,8.3K,379.3K,80.9K,"As the year winds down and we look toward 2019, I’m asking you to make a commitment: find something you want to change in your community and take the first step toward changing it. If you need some inspiration, take a look at some of the young leaders who inspired me this year."
2018-12-28T14:34:43.000Z,9.5K,278.3K,45.9K,"As 2018 draws to a close, I’m continuing the tradition of sharing my year-end lists. It gives me a moment to reflect on the year through the books, movies, and music that I found most thought-provoking, inspiring, or just plain loved. I hope you enjoy it: "
2018-12-25T14:14:37.000Z,24K,907.4K,88.6K,Enjoy the holiday season with the ones you love. Michelle and I wish you a very Merry Christmas!
2018-12-20T20:55:31.000Z,8.2K,199.5K,31.9K,There’s no better time than the holidays to give back to your community. Yesterday I got to do just that at 
2018-12-19T21:48:12.000Z,13.9K,391.2K,63.6K,"Merry Christmas and happy holidays to the extraordinary kids, families, and staff at Children’s National. And thanks for humoring me as your stand-in Santa."
2018-12-15T21:15:39.000Z,5.1K,76.8K,22.6K,Today is the last day of open enrollment. That means it’s the deadline to make sure you and the people you love have health insurance in 2019. So head over to 
2018-12-19T21:48:12.000Z,13.9K,391.2K,63.6K,"Merry Christmas and happy holidays to the extraordinary kids, families, and staff at Children’s National. And thanks for humoring me as your stand-in Santa."
2018-12-15T00:58:26.000Z,3.6K,150.9K,31.9K,Joe is right. Head to 
2018-12-13T04:15:34.000Z,6.9K,210.1K,42.4K,"As Bobby Kennedy taught us, the thing about hope is that it travels through space *and* time, first splashing against the rocks, but eventually breaking down the walls of cruelty and injustice. And if we do our best with the time we’re given, others will take hope in our example."
2018-11-18T23:32:03.000Z,2.4K,89.9K,13.9K,"When someone shares their story, we see the world through their eyes. I’m looking forward to hearing a few from leaders around the world and sharing my own at the "
2018-11-15T16:43:52.000Z,2.6K,89.7K,15.8K,"Our future depends on all our young people, including our boys and young men of color, being able to achieve their dreams. Today, I’m proud to share "
2018-11-13T18:37:35.000Z,9.3K,526.9K,63.2K,"Of course, "
2018-11-12T03:20:49.000Z,6.2K,286.3K,52.9K,"Michelle and I are heartbroken for everybody who’s lost so much in California, and grateful for the heroism of the firefighters who’ve been risking their lives around the clock to save others. Please do what you can to help our fellow Americans in need:"
2018-11-11T16:14:40.000Z,10.8K,657.6K,109.2K,"To all our veterans and your families: thank you. There's no tribute that can truly match the magnitude of your service and sacrifice. But all of us can do our best to live up to the American values of service, responsibility, generosity, and citizenship that you helped defend."
2018-11-07T16:13:21.000Z,6.3K,318.7K,50K,"Congratulations to everybody who showed up and participated in our democracy in record numbers yesterday. The change we need won’t come from one election alone – but it is a start. Last night, voters across the country started it."
2018-11-06T16:26:40.000Z,5.1K,170.7K,37.7K,"Today is the day. Today, it’s your turn to raise your voice to change the course of this country for the better. So make it count. Get out there and vote. Go to "
2018-11-05T18:46:31.000Z,2.3K,69K,17.9K,"If you take that power and vote, something powerful happens. Change happens. Hope happens. And with each new step we take in the direction of fairness, and justice, and equality, and opportunity, hope spreads. Go vote!"
2018-11-05T18:46:30.000Z,1.1K,101.5K,25K,"When you vote, you have the power to make it easier for a student to afford college, and harder for a disturbed person to shoot up a classroom. When you vote, you have the power to make sure a family keeps its health insurance."
2018-11-05T18:46:29.000Z,532,59.5K,13.4K,"When you vote, you have the power to protect voting rights. To make sure our criminal justice system treats everyone equally under the law. To strengthen laws that protect women in the workplace from harassment – and make sure they’re paid equally."
2018-11-05T18:46:28.000Z,729,51.3K,11.2K,"When we've been at such crossroads before, Americans have made the right choice. Not because we sat back and waited for history to happen -- but because we marched, and mobilized, and voted. We made history happen."
2018-11-05T18:46:27.000Z,7.8K,503.8K,135.7K,Tomorrow’s elections might be the most important of our lifetimes. The health care of millions is on the ballot. Making sure working families get a fair shake is on the ballot. The character of our country is on the ballot.
2018-11-01T21:20:50.000Z,3.5K,55.2K,21K,"Speaking of preexisting conditions, open enrollment starts today. If you or someone you know needs health care, visit "
2018-11-01T18:32:47.000Z,2.1K,32.7K,8.3K,"Elections matter. You have the power to protect a family’s health care. Make a plan, grab some friends, and vote:"
2018-11-01T18:32:46.000Z,2K,72K,21.3K,"While we're talking about preexisting conditions, the ACA is the law that finally protected your coverage for preexisting conditions.

Those protections and your health care are absolutely at stake on Tuesday. Vote for Democrats who’ll protect them."
2018-10-31T18:20:55.000Z,4.2K,96K,35.2K,Not sure who and what you can vote for? Head over to 
2018-10-11T14:01:16.000Z,3.4K,185.7K,32.6K,I’m so proud of the work 
2018-10-09T03:47:49.000Z,5.1K,321.7K,33.3K,Congratulations to Drew Brees on the all time passing record. Always a class act.
2018-10-03T19:08:58.000Z,18.6K,677.3K,65.4K,"Happy Anniversary, "
2018-10-01T16:46:18.000Z,9.5K,208.3K,45K,"Today, I’m proud to endorse even more Democratic candidates who aren’t just running against something, but for something—to expand opportunity for all of us and to restore dignity, honor, and compassion to public service. They deserve your vote:"
2018-09-29T16:29:29.000Z,2.9K,114K,11K,"From civil servants to organizers, the young people I met in Amsterdam today are doing the hard work of change. And they keep at it for their communities, their countries, and the collective future of Europe and the world. Keep up the good work."
2018-09-25T20:49:10.000Z,10.1K,369.7K,96.8K,"The antidote to government by a powerful few is government by the organized, energized many. This National Voter Registration Day, make sure you're registered, vote early if you can, or show up on November 6. This moment is too important to sit out."
2018-09-14T16:20:47.000Z,3.9K,86.9K,13.1K,"The first class of Obama Fellows is full of leaders like Keith—hardworking, innovative, and dedicated to partnering with their communities to drive transformational change."
2018-09-11T13:52:34.000Z,11.1K,741.5K,132.6K,"We will always remember everyone we lost on 9/11, thank the first responders who keep us safe, and honor all who defend our country and the ideals that bind us together. There's nothing our resilience and resolve can’t overcome, and no act of terror can ever change who we are."
2018-09-08T15:00:01.000Z,8.9K,128.6K,53K,NowThis
2018-09-07T15:08:22.000Z,18.1K,258.1K,45.5K,"Today I’m at the University of Illinois to deliver a simple message to young people all over the country: You need to vote, because our democracy depends on it. I hope you'll tune in at 11am CT: "
2018-10-11T14:01:16.000Z,3.4K,185.7K,32.6K,I’m so proud of the work 
2018-09-08T15:00:01.000Z,8.9K,128.6K,53K,NowThis
2018-09-08T15:00:01.000Z,8.9K,128.6K,53K,NowThis
